text_id,clause,answer,evidence,justification
authority_00379,X_equality,0,,The text contains only friendly personal remarks and does not mention any group-based discrimination or unequal treatment.
authority_00379,X_proportionality,0,,"The text contains only friendly well-wishes and a request for updates, with no mention of corruption, nepotism, cheating, or unfair reward."
authority_00379,X_loyalty,0,,"The passage contains only well-wishes and a request for updates, with no reference to in-group loyalty, solidarity, or betrayal."
authority_00379,A_order_stance,0,,"The text only offers well-wishes and a request for updates, without any stance on obedience, deference, or social order."
authority_00379,A_order_values,0,,"The passage contains only friendly well-wishes and a request for news, with no mention or evaluation of obedience, hierarchy, tradition, or social order."
authority_00379,A_assess_authority,0,,"The text contains only personal well-wishes and requests for updates, with no evaluation of any authority or power holder."
authority_00380,D_entity,0,,"The text only expresses confusion and asks about helping with domain names, without mentioning any authority or social order."
authority_00380,X_equality,0,,"The text contains no mention of racism, sexism, or any form of group-based discrimination or unequal treatment."
authority_00380,X_proportionality,0,,"The text contains no mention of corruption, nepotism, cheating, or unfair reward."
authority_00380,X_loyalty,0,,"The text contains no reference to in-group loyalty, solidarity, or betrayal."
authority_00380,A_order_stance,0,,"The text only questions the sense of a statement and asks about helping with domain names, without any reference to obedience, deference, or social order."
authority_00380,A_order_values,0,,"The text does not discuss obedience, hierarchy, tradition, or social order as values."
authority_00380,A_assess_authority,0,,"The text does not assess any authority, leader, institution, or power holder, but merely questions the relevance of the response."
authority_00381,D_entity,1,Le Pen sinta falta do meu apoio ... total falta de democracia da EU,"The text refers to the politician Le Pen and the European Union, both of which are authority figures or institutions."
authority_00381,X_equality,0,,"The text only criticizes the EU's democratic shortcomings and condescending attitude, without mentioning any group-based discrimination or unequal treatment."
authority_00381,X_proportionality,0,,"The text only expresses concerns about democracy and the EU's attitude, without mentioning corruption, nepotism, cheating, or unfair reward."
authority_00381,X_loyalty,0,,The text critiques the EU's democracy and attitude but does not raise a concern about loyalty or betrayal toward any in-group.
authority_00381,A_order_stance,0,,"The text critiques the EU's attitude but does not explicitly support or oppose obedience, deference, or social order."
authority_00381,A_order_values,0,,"The text critiques the EU's attitude and lack of democracy but does not explicitly evaluate obedience, hierarchy, tradition, or social order as values."
authority_00381,A_assess_authority,1,Preocupa-me a total falta de democracia da EU e a sua atitude prepotente e condescendente.,"The passage judges the EU's conduct and legitimacy as an authority, labeling it undemocratic and prepotent."
authority_00382,D_entity,1,Não podemos andar a culpar os políticos por tudo,"The passage explicitly refers to politicians, who are authority figures."
authority_00382,X_equality,1,"xenófoba, racista e patriarcal","The text explicitly labels society as xenophobic, racist, and patriarchal, highlighting concerns about discrimination and unequal treatment."
authority_00382,X_proportionality,0,,"The text criticizes society and politicians but does not explicitly mention corruption, nepotism, cheating, or unfair reward."
authority_00382,X_loyalty,0,,The passage critiques society and its flaws without mentioning any concern about loyalty or betrayal toward an in-group.
authority_00382,A_order_stance,0,,"The text critiques society but does not express support for or opposition to obedience, deference, or social order."
authority_00382,A_order_values,0,,"The text criticizes society but does not discuss obedience, hierarchy, tradition, or social order as values."
authority_00382,A_assess_authority,0,,The text critiques society and politicians in general but does not evaluate a specific authority or institution's fitness or legitimacy in exercising power.
authority_00383,D_entity,0,,
authority_00383,X_equality,0,,The text discusses political and intelligence matters without mentioning any group-based discrimination or unequal treatment.
authority_00383,X_proportionality,0,,"The text discusses political speculation about intelligence cooperation and potential information leaks, without mentioning corruption, nepotism, cheating, or unfair reward."
authority_00383,X_loyalty,0,,"The text does not explicitly mention loyalty or betrayal toward any group, only criticizes a strategy."
authority_00383,A_order_stance,0,,"The text discusses political strategy and intelligence cooperation without expressing support for or opposition to obedience, deference, or social order."
authority_00383,A_order_values,0,,"The text discusses political strategy and intelligence cooperation without evaluating obedience, hierarchy, tradition, or social order as values."
authority_00383,A_assess_authority,1,Parece uma estratégia de longo prazo terrível.,"The text judges Macron's potential use of power to direct French intelligence as a terrible strategy, evaluating his conduct as a leader."
authority_00384,D_entity,1,a administração estava disposta a intervir em casos extremos,"The text refers to 'a administração', an institutional authority that can intervene."
authority_00384,X_equality,1,assédio com base na filiação religiosa,"The text explicitly mentions harassment based on religious affiliation, indicating concern about discrimination against a social group."
authority_00384,X_proportionality,0,,"The passage addresses religious harassment and administrative intervention, not concerns about corruption, nepotism, cheating, or unfair reward."
authority_00384,X_loyalty,0,,The text describes interdenominational conflicts and administrative intervention but does not explicitly raise a concern about in-group loyalty or betrayal.
authority_00384,A_order_stance,0,,"The text merely comments on past interdenominational struggles and administrative intervention without praising or condemning obedience, deference, or social order."
authority_00384,A_order_values,0,,"The text does not discuss obedience, hierarchy, tradition, or social order as values, nor does it evaluate them positively or negatively."
authority_00384,A_assess_authority,1,"a administração estava disposta a intervir em casos extremos, que basicamente equivaliam a assédio com base na filiação religiosa","The passage critiques the administration's power to intervene, judging its conduct as harassment, thus evaluating its authority."
authority_00385,D_entity,0,,"The text does not mention any ruler, leader, institution, law, or other authority figure or social order."
authority_00385,X_equality,0,,The passage discusses a metaphor about discipline and does not mention any group-based discrimination or unequal treatment.
authority_00385,X_proportionality,0,,"The text discusses discipline and accusations of abuse but does not mention corruption, nepotism, cheating, or unfair reward."
authority_00385,X_loyalty,0,,"The text discusses violence, discipline, and frustration with explanations, but does not mention loyalty, solidarity, or betrayal toward any group."
authority_00385,A_order_stance,1,"Defendo, acima de tudo, uma disciplina ou conversa significativa.","The speaker explicitly supports discipline, which reflects a stance favoring social order and obedience."
authority_00385,A_order_values,1,"Defendo, acima de tudo, uma disciplina ou conversa significativa.",The speaker explicitly upholds discipline (a form of social order) as a valued principle.
authority_00385,A_assess_authority,0,,"The text discusses a metaphor about discipline and denies supporting violence, without evaluating any authority, leader, or institution."
authority_00386,D_entity,1,A tua mãe vai compreender.,"The text refers to the mother, which is a parent and thus an authority figure."
authority_00386,X_equality,0,,"The text discusses personal manipulation and predatory behavior in a relationship, without mentioning any group-based discrimination or unequal treatment."
authority_00386,X_proportionality,0,,"The text discusses personal manipulation and predatory behavior, without mentioning corruption, nepotism, cheating, or unfair reward."
authority_00386,X_loyalty,0,,"The passage addresses personal relationship manipulation and does not mention any concern about loyalty or betrayal toward a group, team, side, party, or nation."
authority_00386,A_order_stance,0,,"The text discusses personal relationship dynamics and does not express a stance on obedience, deference, or social order."
authority_00386,A_order_values,0,,"The text discusses personal relationship dynamics and manipulation without evaluating obedience, hierarchy, tradition, or social order as values."
authority_00386,A_assess_authority,0,,"The text discusses a personal relationship and manipulative behavior, not an evaluation of a political authority or institution."
authority_00387,D_entity,1,"“o governo não é a solução, é o problema”. Essa gente quer regressar aos tempos dos reis e príncipes","The text explicitly refers to the government and to rulers (reis e príncipes), which are authority figures and a social order."
authority_00387,X_equality,1,Eles não deveriam ter melhores cuidados médicos ou protecções do que os cidadãos que os elegeram.,"The text explicitly claims that a group should not receive better medical care or protections than citizens, indicating a concern about unequal treatment."
authority_00387,X_proportionality,1,impedir que seja controlado por aqueles que o enfraquecem para aumentar a sua riqueza e poder,"The text explicitly warns against those who weaken the government to increase their own wealth and power, indicating a concern about corruption and unfair advantage."
authority_00387,X_loyalty,1,"Nós, os servos, é que gostamos do governo — se conseguirmos impedir que seja controlado por aqueles que o enfraquecem",The passage expresses concern about protecting the group’s loyalty to the government and preventing betrayal by those who would weaken it.
authority_00387,A_order_stance,1,Eles não deveriam ter melhores cuidados médicos ou protecções do que os cidadãos que os elegeram.,"The text opposes obedience and deference to authority, demanding that those in power be treated like ordinary citizens and held accountable."
authority_00387,A_order_values,1,"Essa gente quer regressar aos tempos dos reis e príncipes, à Idade Feudal.","The text condemns a desire to return to feudal hierarchy, indicating a negative evaluation of hierarchy and tradition as values."
authority_00387,A_assess_authority,1,"se a nossa água, o nosso ar ou o nosso solo fosse poluído sob o seu governo, deveriam ser processados e presos.","The text judges the government's conduct and legitimacy by stating it should be punished if it pollutes, evaluating it as an authority exercising power."
authority_00388,D_entity,1,minha chefe,"The text explicitly mentions 'minha chefe', referring to a boss, which is an authority figure."
authority_00388,X_equality,0,,The text discusses salary secrecy and arbitrary pay but does not mention discrimination against any social group.
authority_00388,X_proportionality,1,Eles não querem que saibamos como os nossos salários são arbitrários,"The text explicitly complains that salaries are arbitrary, indicating a concern about unfair or undeserved compensation."
authority_00388,X_loyalty,0,,"The text discusses salary secrecy and the boss's reaction, but does not explicitly raise a concern about loyalty or betrayal toward any group."
authority_00388,A_order_stance,0,,"The text describes the boss's desire to keep salary information hidden but does not explicitly support or oppose obedience, deference, or social order."
authority_00388,A_order_values,1,"""Eles não querem que saibamos como os nossos salários são arbitrários e muito menos querem que usemos os salários dos outros para negociar aumentos.""","The speaker resents the hierarchical control over salary information, rejecting the expectation of compliance."
authority_00388,A_assess_authority,1,Eles não querem que saibamos como os nossos salários são arbitrários e muito menos querem que usemos os salários dos outros para negociar aumentos.,"The text criticizes the boss's control over salary information, evaluating their use of power as arbitrary and restrictive."
authority_00389,D_entity,0,,"The text only mentions 'esquerdistas' and does not refer to any authority, official, or institutional power."
authority_00389,X_equality,1,mas não dizem nada quando se trata da religião mais perseguida do mundo: o Cristianismo.,"The text highlights perceived unfair exclusion of Christians, indicating concern about religious discrimination."
authority_00389,X_proportionality,1,"""não dizem nada quando se trata da religião mais perseguida do mundo: o Cristianismo.""","The text complains that Christianity is unfairly ignored despite being the most persecuted religion, indicating a concern about unfair treatment."
authority_00389,X_loyalty,0,,The text critiques a group’s actions but does not explicitly raise a concern about loyalty or betrayal toward an in-group.
authority_00389,A_order_stance,0,,"The text discusses political criticism and religious persecution but does not address obedience, deference, or social order."
authority_00389,A_order_values,0,,"The passage discusses charitable donations and religious persecution but does not evaluate obedience, hierarchy, tradition, or social order as values."
authority_00389,A_assess_authority,0,,"The text critiques a political group’s actions but does not evaluate a specific authority, leader, or institution in its power role."
authority_00390,D_entity,0,,"The text contains only a personal preference statement and does not mention any authority, ruler, institution, or social order."
authority_00390,X_equality,0,,The text expresses a personal preference and does not mention any group-based discrimination or unequal treatment.
authority_00390,X_proportionality,0,,"The text only expresses a personal preference about selfishness versus loneliness and does not mention corruption, nepotism, cheating, or fairness."
authority_00390,X_loyalty,0,,The text discusses personal selfishness versus loneliness and does not mention any concern about loyalty or betrayal toward a group or collective.
authority_00390,A_order_stance,0,,"The text does not discuss obedience, deference, or social order in any way."
authority_00390,A_order_values,0,,"The text does not mention or evaluate obedience, hierarchy, tradition, or social order as values."
authority_00390,A_assess_authority,0,,"The text expresses a personal preference and does not evaluate any authority, leader, institution, or power holder."
authority_00391,D_entity,1,a constituição diz que podemos depor o governo,"The text explicitly mentions the constitution and the government, both of which are authorities or institutional powers."
authority_00391,X_equality,0,,"The text discusses constitutional rights to depose the government, without mentioning any group-based discrimination or unequal treatment."
authority_00391,X_proportionality,1,a constituição diz que podemos depor o governo se não estiver certo e for contra o povo,"The text warns that the government may be acting against the people, indicating a concern about unfair or undeserved treatment."
authority_00391,X_loyalty,1,a constituição diz que podemos depor o governo se não estiver certo e for contra o povo,"The text warns that the government could act against the people and suggests deposing it, highlighting concern about betrayal of the in-group."
authority_00391,A_order_stance,1,"Ó rapaz, a constituição diz que podemos depor o governo se não estiver certo e for contra o povo.","The text encourages overthrowing the government when it is unjust, which is a stance opposing obedience and deference to authority."
authority_00391,A_order_values,1,a constituição diz que podemos depor o governo se não estiver certo e for contra o povo,"The text rejects obedience to a government that is against the people, thereby evaluating hierarchy/obedience as not a valued good."
authority_00391,A_assess_authority,1,a constituição diz que podemos depor o governo se não estiver certo e for contra o povo,The text evaluates the government's legitimacy by stating it can be deposed if it is not right and opposes the people.
authority_00392,D_entity,1,"""o Macron ser o voto estratégico""","The text explicitly names Macron, a political leader, which is an authority figure."
authority_00392,X_equality,0,,The text discusses political positioning and voting strategy without mentioning any group-based discrimination or unequal treatment.
authority_00392,X_proportionality,0,,"The text discusses political positioning and voting strategy without mentioning corruption, nepotism, cheating, or unfair reward."
authority_00392,X_loyalty,0,,The passage discusses political positioning and strategic voting without mentioning loyalty or betrayal toward a group.
authority_00392,A_order_stance,0,,"The text discusses political positioning and strategic voting without any reference to obedience, deference, or social order."
authority_00392,A_order_values,0,,"The text discusses political centrist positions and strategic voting without evaluating obedience, hierarchy, tradition, or social order as values."
authority_00392,A_assess_authority,0,,"The text mentions Macron only as a strategic vote without judging his fitness, legitimacy, or conduct as a holder of power."
authority_00393,D_entity,0,,"The text only mentions a Geico advertisement and does not refer to any authority, official, or social order."
authority_00393,X_equality,0,,"The text only comments on a Geico advertisement being humorous and contains no mention of racism, sexism, or any form of group-based discrimination."
authority_00393,X_proportionality,0,,"The text only describes a Geico ad as hilarious and self‑satirical, without mentioning corruption, nepotism, cheating, or unfair reward."
authority_00393,X_loyalty,0,,"The text only comments on a Geico advertisement being hilarious and self‑satirical, without mentioning any concern about loyalty or betrayal toward a group."
authority_00393,A_order_stance,0,,"The text only comments on a Geico ad being hilarious and does not discuss obedience, deference, or social order."
authority_00393,A_order_values,0,,"The text only comments on a Geico ad being hilarious and self‑satirical, with no evaluation of obedience, hierarchy, tradition, or social order."
authority_00393,A_assess_authority,0,,"The text only comments on a Geico advertisement being hilarious and does not evaluate any authority, leader, or institution in terms of power or legitimacy."
authority_00394,D_entity,1,"Usa o governo para fortalecer os agitadores, depois usa os agitadores para fortalecer o governo.","The text explicitly mentions 'governo', which is a governmental authority."
authority_00394,X_equality,0,,"The text does not mention any group-based discrimination, oppression, or unequal treatment."
authority_00394,X_proportionality,1,"Usa o governo para fortalecer os agitadores, depois usa os agitadores para fortalecer o governo.","The text describes a cycle of using government power to benefit agitators and vice versa, implying corrupt manipulation of authority."
authority_00394,X_loyalty,0,,The text discusses a cyclical relationship between government and agitators but does not mention loyalty or betrayal toward any group.
authority_00394,A_order_stance,0,,"The text describes a cyclical relationship between government and agitators without explicitly supporting or opposing obedience, deference, or social order."
authority_00394,A_order_values,0,,"The text does not discuss obedience, hierarchy, tradition, or social order as values."
authority_00394,A_assess_authority,0,,"The text describes a cycle involving the government but does not evaluate its conduct, legitimacy, or fitness as a holder of power."
authority_00395,D_entity,1,"A Le Pen tem probabilidades muito, muito piores do que qualquer um desses.","The text mentions Le Pen, a political figure who is a candidate for power, fitting the definition of an authority-holder."
authority_00395,X_equality,0,,The text only comments on Le Pen's probabilities and does not mention any group-based discrimination or unequal treatment.
authority_00395,X_proportionality,0,,"The text only comments on Le Pen's probabilities and does not mention corruption, nepotism, cheating, or unfair reward."
authority_00395,X_loyalty,0,,"The text only comments on Le Pen's odds and does not discuss loyalty, betrayal, or solidarity toward any group."
authority_00395,A_order_stance,0,,"The text does not discuss obedience, deference, or social order, nor supports or opposes them."
authority_00395,A_order_values,0,,"The text does not discuss obedience, hierarchy, tradition, or social order as values."
authority_00395,A_assess_authority,1,"A Le Pen tem probabilidades muito, muito piores do que qualquer um desses.","The statement judges Le Pen's likelihood of gaining power as worse than others, evaluating her as a contender for authority."
authority_00396,D_entity,0,,"The text only discusses personal remarks about Beetlejuice and does not mention any authority, ruler, institution, or social order."
authority_00396,X_equality,0,,The text only contains personal insults toward two women and does not discuss any group-based discrimination or unequal treatment.
authority_00396,X_proportionality,0,,"The text only discusses personal grievances about hair and insults, without mentioning corruption, nepotism, cheating, or unfair reward."
authority_00396,X_loyalty,0,,"The text contains personal insults but does not discuss loyalty, solidarity, or betrayal toward any group or side."
authority_00396,A_order_stance,0,,"The text contains insults but does not express a stance supporting or opposing obedience, deference, or social order."
authority_00396,A_order_values,0,,"The passage critiques individuals and their actions but does not discuss obedience, hierarchy, tradition, or social order as values."
authority_00396,A_assess_authority,0,,"The text merely insults two women without assessing their authority, legitimacy, or fitness to hold power."
authority_00397,D_entity,0,,"The passage contains no reference to any authority, official, institution, law, or similar social order."
authority_00397,X_equality,0,,The passage discusses growth rates and arguments without mentioning any form of group-based discrimination or unequal treatment.
authority_00397,X_proportionality,0,,"The passage discusses growth rates and argument validity, without mentioning corruption, nepotism, cheating, or unfair reward."
authority_00397,X_loyalty,0,,"The passage discusses growth rates, argument validity, and insults, without any reference to in-group loyalty or betrayal."
authority_00397,A_order_stance,0,,"The text discusses growth rates and arguments without any reference to obedience, deference, or social order."
authority_00397,A_order_values,0,,"The text does not mention or evaluate obedience, hierarchy, tradition, or social order as values."
authority_00397,A_assess_authority,0,,"The text critiques an individual's argument without evaluating any authority, leader, or institution in a power role."
authority_00398,D_entity,0,,"The passage only discusses Antifa and the Washington Post without referencing any authority, ruler, institution, or social order."
authority_00398,X_equality,0,,"The passage debates political labeling of Antifa without mentioning racism, sexism, civil rights, oppression, privilege, or unfair exclusion of a social group."
authority_00398,X_proportionality,0,,"The text discusses political labeling of Antifa and does not mention corruption, nepotism, cheating, or unfair reward."
authority_00398,X_loyalty,0,,"The text discusses ideological labeling of Antifa but does not mention loyalty, betrayal, or solidarity within a group."
authority_00398,A_order_stance,0,,"The text discusses Antifa and criticizes a claim without addressing obedience, deference, or social order."
authority_00398,A_order_values,0,,"The text discusses political labeling and criticism without referencing obedience, hierarchy, tradition, or social order as values."
authority_00398,A_assess_authority,0,,"The text critiques the characterization of Antifa but does not evaluate a specific authority, leader, or institution in its power role."
authority_00399,D_entity,1,Le Pen,"The text explicitly mentions ""Le Pen,"" a political leader, which qualifies as an authority figure."
authority_00399,X_equality,1,"""o que é que a Le Pen fez de preconceituoso e/ou odioso?""","The text explicitly asks about Le Pen's prejudiced or hateful actions, indicating concern about group-based discrimination."
authority_00399,X_proportionality,0,,"The text only asks about Le Pen's prejudiced or hateful actions and does not mention corruption, nepotism, cheating, or unfair reward."
authority_00399,X_loyalty,0,,The text only asks about Le Pen's prejudiced or hateful actions and does not discuss in-group loyalty or betrayal.
