text_id,clause,answer,evidence,justification
authority_00000,D_entity,1,presidentes ... Sarkozy e Hollande ... gostamos de ter os nossos reis,"The text explicitly mentions presidents and specific political leaders, which are authority figures."
authority_00000,X_equality,0,,The text discusses political leaders and monarchy without mentioning any group-based discrimination or unequal treatment.
authority_00000,X_proportionality,1,como vivem num palácio luxuoso e no poder que têm,"The text criticizes presidents living luxuriously, implying they receive more than they deserve, which raises a concern about unfair reward."
authority_00000,X_loyalty,1,gostamos ainda mais de lhes cortar a cabeça,"The text expresses a desire to violently betray and kill the nation's leaders, indicating concern about treachery toward one's own group."
authority_00000,A_order_stance,1,gostamos ainda mais de lhes cortar a cabeça,"The text opposes deference to authority by praising the desire to cut off leaders' heads, indicating a stance against obedience and social order."
authority_00000,A_order_values,1,"gostamos da nossa ""monarquia""","The text explicitly states that the culture likes (upholds) the monarchy, evaluating hierarchy as a valued cultural preference."
authority_00000,A_assess_authority,1,como vivem num palácio luxuoso e no poder que têm,"The text judges presidents as power holders, criticizing their luxurious lifestyle and expressing a desire to remove them, thus evaluating their authority."
authority_00001,D_entity,0,,"The text does not mention any authority, ruler, institution, or social order."
authority_00001,X_equality,0,,"The text does not mention any form of racism, sexism, oppression, or unfair exclusion of a social group."
authority_00001,X_proportionality,0,,"The text does not mention corruption, nepotism, cheating, or unfair reward."
authority_00001,X_loyalty,0,,"The passage discusses personal behavior and false modesty, without any reference to loyalty or betrayal toward a group or side."
authority_00001,A_order_stance,0,,"The text does not contain any explicit reference to obedience, deference, or social order, nor does it support or oppose such concepts."
authority_00001,A_order_values,0,,"The text does not mention or evaluate obedience, hierarchy, tradition, or social order as values."
authority_00001,A_assess_authority,0,,"The text critiques an individual's behavior and character, not a specific authority, leader, institution, or power holder."
authority_00002,D_entity,1,"O Bernie Sanders, o Mélenchon e muitos outros políticos de esquerda notáveis elogiaram abertamente o Chávez e o socialismo venezuelano.","The text explicitly names political leaders (e.g., Chávez, Bernie Sanders, Mélenchon) who are authority figures."
authority_00002,X_equality,0,,
authority_00002,X_proportionality,0,,"The passage discusses socialism and dictatorship without mentioning corruption, nepotism, cheating, or unfair reward."
authority_00002,X_loyalty,0,,"The passage discusses criticism of Venezuelan socialism and mentions politicians' praise, but does not raise any explicit concern about loyalty or betrayal to a group."
authority_00002,A_order_stance,0,,"The text discusses socialism and dictatorship but does not explicitly support or oppose obedience, deference, or social order."
authority_00002,A_order_values,0,,The text mentions dictatorship and authoritarianism as a pillar of theory but does not explicitly uphold or reject them as values.
authority_00002,A_assess_authority,0,,"The passage discusses socialist policies and dictatorship in abstract terms without explicitly judging Chávez or any authority's fitness, legitimacy, or trustworthiness as a holder of power."
authority_00003,D_entity,0,,"The text only mentions ""os americanos"" as agents, without naming any authority, official, or institutional power."
authority_00003,X_equality,0,,"The text merely states that the careers were killed by Americans without explicitly mentioning racism, sexism, oppression, or any group-based discrimination."
authority_00003,X_proportionality,0,,"The text does not explicitly mention corruption, nepotism, cheating, or unfair reward."
authority_00003,X_loyalty,0,,"The text does not explicitly discuss loyalty, betrayal, or solidarity toward any group."
authority_00003,A_order_stance,0,,"The text merely states a claim about careers being killed and does not express support for or opposition to obedience, deference, or social order."
authority_00003,A_order_values,0,,"The text does not discuss obedience, hierarchy, tradition, or social order as values."
authority_00003,A_assess_authority,0,,"The text only comments on the careers of individuals being ended by Americans, without evaluating any specific authority or power holder."
authority_00004,D_entity,1,"À medida que inúteis corruptos de merda como Merkel e Macron continuam a ser eleitos, o número de Dutertes vai aumentar no mundo.","The text explicitly names political leaders (Merkel, Macron, Duterte, Trump, Hitler), which are authority figures."
authority_00004,X_equality,0,,The text critiques political leaders and authoritarianism but does not mention any group-based discrimination or unequal treatment.
authority_00004,X_proportionality,0,,
authority_00004,X_loyalty,0,,The text critiques political leaders and globalism but does not mention loyalty or betrayal toward any group or nation.
authority_00004,A_order_stance,0,,"The text critiques leaders and mentions authoritarianism but does not explicitly support or oppose obedience, deference, or social order."
authority_00004,A_order_values,0,,"The text critiques political leaders and authoritarianism but does not explicitly evaluate obedience, hierarchy, tradition, or social order as values."
authority_00004,A_assess_authority,1,inúteis corruptos de merda como Merkel e Macron continuam a ser eleitos,"The passage explicitly judges Merkel and Macron as corrupt, unfit leaders, evaluating their conduct as holders of power."
authority_00005,D_entity,1,Macron,"The text explicitly names the French President Macron, an authority figure, and also mentions a law, indicating reference to an authority."
authority_00005,X_equality,1,"A forma como a França trata os falantes de bretão é injusta, esperemos que Macron consiga mudar isso.","The text explicitly states that the treatment of Breton speakers in France is unfair, highlighting a concern about group-based discrimination."
authority_00005,X_proportionality,1,A forma como a França trata os falantes de bretão é injusta,"The text explicitly states that the treatment of Breton speakers is unfair, indicating a concern about them receiving less than they deserve."
authority_00005,X_loyalty,1,"A forma como a França trata os falantes de bretão é injusta, esperemos que Macron consiga mudar isso. Acho que os bretões devem lutar por uma lei da língua bretã.",The text expresses concern about the unfair treatment of Breton speakers and calls for Breton solidarity in fighting for language rights.
authority_00005,A_order_stance,1,"A forma como a França trata os falantes de bretão é injusta, esperemos que Macron consiga mudar isso. Acho que os bretões devem lutar por uma lei da língua bretã.","The text condemns the current treatment of Breton speakers and urges Bretons to fight for language rights, opposing the existing social order."
authority_00005,A_order_values,0,,"The text critiques language policy but does not discuss obedience, hierarchy, tradition, or social order as values."
authority_00005,A_assess_authority,1,"A forma como a França trata os falantes de bretão é injusta, esperemos que Macron consiga mudar isso.","The text judges France's treatment of Breton speakers as unjust and expresses hope that leader Macron can change it, evaluating his role as a holder of power."
authority_00006,D_entity,1,É por isto que o Macron ganhou.,"The text explicitly mentions Macron, who is a political leader and authority figure."
authority_00006,X_equality,0,,"The text discusses Macron's political identity and a personal anecdote about a student and a professor, without mentioning any group-based discrimination or unequal treatment."
authority_00006,X_proportionality,0,,"The text discusses Macron's political identity and a personal anecdote without mentioning corruption, nepotism, cheating, or unfair reward."
authority_00006,X_loyalty,0,,"The passage discusses Macron's political identity and a personal advice scenario, without mentioning loyalty, betrayal, or in-group solidarity."
authority_00006,A_order_stance,0,,"The text discusses political identity and romantic advice, without any stance on obedience, deference, or social order."
authority_00006,A_order_values,0,,"The passage discusses personal advice and political identity without evaluating obedience, hierarchy, tradition, or social order as values."
authority_00006,A_assess_authority,0,,"The text describes Macron's behavior and a comment about his political identity but does not explicitly evaluate his fitness, legitimacy, or trustworthiness as a holder of power."
authority_00007,D_entity,0,,"The text only mentions personal feelings and a brother's actions, without naming any authority, official, or social order."
authority_00007,X_equality,0,,The passage discusses personal forgiveness and responsibility without mentioning any group-based discrimination or unequal treatment.
authority_00007,X_proportionality,0,,"The passage discusses personal guilt and forgiveness, without mentioning corruption, nepotism, cheating, or unfair reward."
authority_00007,X_loyalty,0,,"The passage discusses personal forgiveness and blame regarding a brother's actions, without any reference to in-group loyalty or betrayal."
authority_00007,A_order_stance,0,,"The passage only discusses personal forgiveness and does not express any stance supporting or opposing obedience, deference, or social order."
authority_00007,A_order_values,0,,"The text does not discuss obedience, hierarchy, tradition, or social order as values."
authority_00007,A_assess_authority,0,,"The text discusses personal forgiveness and a brother's actions, without evaluating any authority, leader, institution, or power holder."
authority_00008,D_entity,0,,
authority_00008,X_equality,0,,The text discusses political party factions and potential candidates without mentioning any group-based discrimination or unequal treatment.
authority_00008,X_proportionality,0,,"The passage discusses political factions and potential candidates but does not raise any concerns about corruption, nepotism, cheating, or unfair reward."
authority_00008,X_loyalty,0,,The passage discusses party factions and political possibilities but does not raise a concern about loyalty or betrayal toward any group.
authority_00008,A_order_stance,0,,"The text discusses political party factions and potential candidates without any reference to obedience, deference, or social order."
authority_00008,A_order_values,0,,"The passage discusses political party factions and candidate traits, without evaluating obedience, hierarchy, tradition, or social order as values."
authority_00008,A_assess_authority,1,"Alguém como o Macron, basicamente.","The text evaluates Macron's fitness and legitimacy as a leader, praising his charisma, honesty, and competence."
authority_00009,D_entity,1,Nem a igreja apoia este tirano do caralho,"The text explicitly mentions ""a igreja"" (the church) and calls someone a ""tirano"" (tyrant), both referring to authority figures."
authority_00009,X_equality,0,,The text only condemns a tyrant and does not mention any group-based discrimination or unequal treatment.
authority_00009,X_proportionality,1,este tirano do caralho,"The text labels the person a tyrant and calls for his removal, indicating a concern that he is undeserving of his position."
authority_00009,X_loyalty,0,,"The text condemns a tyrant and calls for his removal, but does not discuss loyalty or betrayal within any group."
authority_00009,A_order_stance,1,DESTITUAM-NO!,"The text urges overthrow of a tyrant, which is a stance opposing obedience and social order."
authority_00009,A_order_values,0,,
authority_00009,A_assess_authority,1,este tirano do caralho,"The text calls a specific leader a tyrant, evaluating his legitimacy and fitness to hold power."
authority_00010,D_entity,1,Cristo,"The text explicitly mentions ""Cristo"", which is a religious authority."
authority_00010,X_equality,0,,"The text does not mention any group-based discrimination, oppression, or unfair exclusion of a social group."
authority_00010,X_proportionality,0,,"The text condemns illegal activity but does not explicitly mention corruption, nepotism, cheating, or unfair reward."
authority_00010,X_loyalty,0,,"The passage critiques personal honor and illegal activity but does not mention loyalty or betrayal toward any group, team, side, party, or nation."
authority_00010,A_order_stance,1,Estás a tentar justificar a tua atividade ilegal.,"The text condemns illegal activity, thereby supporting social order and obedience to lawful norms."
authority_00010,A_order_values,0,,"The text discusses honor and illegal activity but does not evaluate obedience, hierarchy, tradition, or social order as values."
authority_00010,A_assess_authority,0,,"The text only contains personal insults and does not evaluate any authority, leader, or institution in a power role."
authority_00011,D_entity,1,Hollande tinha o apoio do parlamento,"The text explicitly mentions political figures and the parliament, which are authorities and institutional bodies."
authority_00011,X_equality,0,,"The text discusses parliamentary support and political actions, without mentioning any group-based discrimination or unequal treatment."
authority_00011,X_proportionality,0,,"The text discusses parliamentary support and decree usage but does not explicitly mention corruption, nepotism, cheating, or unfair reward."
authority_00011,X_loyalty,0,,The text discusses parliamentary support and potential actions by Le Pen but does not raise a concern about loyalty or betrayal within a group.
authority_00011,A_order_stance,0,,"The text merely comments on parliamentary support and decree without explicitly endorsing or condemning obedience, deference, or social order."
authority_00011,A_order_values,0,,"The text discusses parliamentary support and decree imposition without evaluating obedience, hierarchy, tradition, or social order as values."
authority_00011,A_assess_authority,1,Ele não tinha o apoio do parlamento. Foi por isso que teve de o impor por decreto.,The text judges Hollande's legitimacy as a leader by stating he lacked parliamentary support and had to impose his actions by decree.
authority_00012,D_entity,0,,"The text contains only personal exclamations and does not mention any authority, ruler, institution, or social order."
authority_00012,X_equality,0,,"The text contains no mention of racism, sexism, oppression, or any unfair treatment of a social group."
authority_00012,X_proportionality,0,,"The text contains no mention of corruption, nepotism, cheating, or concerns about fairness or merit."
authority_00012,X_loyalty,0,,"The text contains no reference to in-group loyalty, solidarity, or betrayal."
authority_00012,A_order_stance,0,,"The text does not contain any statements supporting or opposing obedience, deference, or social order."
authority_00012,A_order_values,0,,"The text contains no evaluation of obedience, hierarchy, tradition, or social order as values."
authority_00012,A_assess_authority,0,,"The text contains personal exclamations and does not assess any authority, leader, or institution in a power context."
authority_00013,D_entity,0,,"The text only discusses cult followers and idiots without referencing any authority, ruler, institution, or social order."
authority_00013,X_equality,0,,The passage contains insults toward a group but does not raise a concern about discrimination or unequal treatment.
authority_00013,X_proportionality,0,,"The text does not mention corruption, nepotism, cheating, or unfair reward."
authority_00013,X_loyalty,0,,"The text discusses labeling and voice but does not mention loyalty, solidarity, or betrayal toward any group."
authority_00013,A_order_stance,0,,"The text does not discuss obedience, deference, or social order, nor does it support or oppose such concepts."
authority_00013,A_order_values,0,,"The text does not discuss obedience, hierarchy, tradition, or social order as values."
authority_00013,A_assess_authority,0,,"The text only comments on cult followers and their voice, without evaluating any authority, leader, or institution in a power role."
authority_00014,D_entity,1,por que é que não achas que o Trump tenha causado danos sérios à nossa democracia?... como é que defendes que o Trump não causou danos indescritíveis à nossa democracia?,"The text explicitly mentions Trump, a former president and political leader, which qualifies as an authority-holder."
authority_00014,X_equality,0,,"The text discusses political beliefs about election legitimacy and democratic damage, without mentioning any group-based discrimination or unequal treatment."
authority_00014,X_proportionality,1,"os meios de comunicação conservadores continuam a apregoar a fraude eleitoral em massa (mais uma vez, sem provas)","The text explicitly mentions concerns about alleged mass electoral fraud, which is a form of cheating."
authority_00014,X_loyalty,1,"""mais de metade dos Republicanos não acredita que a eleição tenha sido livre ou justa""","The text highlights Republican loyalty to false election fraud claims, raising concern about group allegiance undermining democratic trust."
authority_00014,A_order_stance,1,"com tantos a acreditar que uma eleição foi roubada, apesar de claramente não ter sido, e tantos a apelar ao que é efetivamente um golpe de estado legal, como é que defendes que o Trump não causou danos indescritíveis à nossa democracia?","The text condemns defiance of democratic order and calls for respect of legitimate election results, thus taking a stance supporting social order."
authority_00014,A_order_values,0,,"The passage discusses election fraud claims and democratic trust, without evaluating obedience, hierarchy, tradition, or social order as values."
authority_00014,A_assess_authority,1,"como é que defendes que o Trump não causou danos indescritíveis à nossa democracia? Ele minou a confiança no próprio voto, na maior afluência às urnas de sempre.","The text judges Trump’s conduct as damaging to democracy, evaluating his legitimacy and fitness as a political leader."
authority_00015,D_entity,0,,"The text only describes personal interactions and does not mention any authority, official, or institutional entity."
authority_00015,X_equality,0,,"The passage only describes personal reactions and jokes about age, without mentioning any group-based discrimination or unequal treatment."
authority_00015,X_proportionality,0,,"The passage only discusses personal anecdotes and reactions, with no mention of corruption, nepotism, cheating, or unfair reward."
authority_00015,X_loyalty,0,,"The passage discusses personal anecdotes and reactions, without any reference to in-group loyalty, solidarity, or betrayal."
authority_00015,A_order_stance,0,,"The text does not discuss obedience, deference, or social order, nor does it support or oppose such concepts."
authority_00015,A_order_values,0,,"The passage discusses personal anecdotes and reactions, without evaluating obedience, hierarchy, tradition, or social order as values."
authority_00015,A_assess_authority,0,,"The passage only describes personal anecdotes and does not evaluate any authority, leader, institution, or power holder."
authority_00016,D_entity,0,,"The text does not mention any authority, ruler, institution, or similar social order."
authority_00016,X_equality,0,,The text does not mention any form of group-based discrimination or unequal treatment.
authority_00016,X_proportionality,0,,"The text does not mention any concern about corruption, nepotism, cheating, or unfair reward."
authority_00016,X_loyalty,0,,"The text does not mention any concern about loyalty, betrayal, or solidarity toward a group."
authority_00016,A_order_stance,0,,"The text does not discuss obedience, deference, or social order, nor supports or opposes them."
authority_00016,A_order_values,0,,"The text does not discuss obedience, hierarchy, tradition, or social order as values."
authority_00016,A_assess_authority,0,,"The text does not assess any authority, leader, or institution regarding its power or legitimacy."
authority_00017,D_entity,1,"Rand Paul devia estar perfeitamente ciente da história do seu estado e tomar uma decisão informada e moral sobre o projeto de lei, ainda mais para tentar reparar as comunidades negras do estado. Claro que é isso que qualquer *bom* senador faria.","The text refers to Rand Paul, a senator, which is a political authority figure."
authority_00017,X_equality,1,ainda mais para tentar reparar as comunidades negras do estado,"The text explicitly references repairing Black communities, indicating a concern about racial discrimination and unequal treatment."
authority_00017,X_proportionality,0,,"The passage discusses a senator's moral decision-making and historical awareness, without mentioning corruption, nepotism, cheating, or unfair reward."
authority_00017,X_loyalty,0,,The passage discusses a senator's moral duty and historical awareness but does not mention loyalty or betrayal toward any group.
authority_00017,A_order_stance,0,,"The passage discusses a senator's moral duty but does not explicitly support or oppose obedience, deference, or social order."
authority_00017,A_order_values,0,,"The text does not discuss obedience, hierarchy, tradition, or social order as values."
authority_00017,A_assess_authority,1,Rand Paul devia estar perfeitamente ciente da história do seu estado e tomar uma decisão informada e moral sobre o projeto de lei...,"The text judges Rand Paul’s fitness and conduct as a senator, evaluating his role as a holder of political power."
authority_00018,D_entity,1,retardado sistema americano de duas facções,"The text refers to the 'American system', which is a collective social order."
authority_00018,X_equality,0,,"The passage critiques political classification and offense but does not raise concerns about racism, sexism, oppression, or unfair exclusion of a protected social group."
authority_00018,X_proportionality,0,,"The text discusses political labeling and criticism of Marine Le Pen but does not mention corruption, nepotism, cheating, or unfair reward."
authority_00018,X_loyalty,1,há muitos conservadores que se sentiriam ofendidos por serem classificados no mesmo grupo que ela,"The text highlights that conservatives would feel offended being classified with Marine Le Pen, indicating a concern about loyalty to their own group."
authority_00018,A_order_stance,0,,"The passage critiques a political figure and does not address obedience, deference, or social order."
authority_00018,A_order_values,0,,"The text discusses political labeling and criticism without evaluating obedience, hierarchy, tradition, or social order as values."
authority_00018,A_assess_authority,1,Marine Le Pen é mais uma demagoga nacionalista,"The text explicitly judges Marine Le Pen's role as a political leader by labeling her a nationalist demagogue, evaluating her fitness and legitimacy to hold power."
authority_00019,D_entity,1,"Trump, Farage, Le Penn são os fascistas mais próximos ou, no mínimo, fascistas relacionados com eles que estiveram no poder no ocidente em 80 anos.","The passage names political leaders (Trump, Farage, Le Penn) who are authority figures."
authority_00019,X_equality,0,,The passage critiques political figures and their supporters without mentioning any group-based discrimination or unequal treatment.
authority_00019,X_proportionality,0,,"The passage discusses fascist labels and voting attitudes but does not mention corruption, nepotism, cheating, or unfair reward."
authority_00019,X_loyalty,0,,The passage critiques fascist supporters and mentions political threats but does not explicitly raise a concern about loyalty or betrayal toward any group.
authority_00019,A_order_stance,0,,"The text does not contain an explicit stance supporting or opposing obedience, deference, or social order."
authority_00019,A_order_values,0,,"The text does not discuss obedience, hierarchy, tradition, or social order as values, only critiques fascists and mentions respect, unity, and tolerance."
authority_00019,A_assess_authority,1,"Trump, Farage, Le Penn são os fascistas mais próximos ou, no mínimo, fascistas relacionados com eles que estiveram no poder no ocidente em 80 anos.","The text labels these political leaders, who held power, as fascists, thereby judging their legitimacy and fitness to hold authority."
authority_00020,D_entity,1,Macron,"The text explicitly names Macron, who is a political leader and authority figure."
authority_00020,X_equality,0,,"The passage critiques perceived economic impacts of immigration but does not mention racism, sexism, or any unfair exclusion of a protected social group."
authority_00020,X_proportionality,1,virem para França e baixarem os salários da população local,"The text expresses concern that locals will receive lower salaries, indicating a worry about unfair reward."
authority_00020,X_loyalty,0,,The text critiques economic and immigration policies but does not explicitly raise a concern about loyalty or betrayal toward a specific group.
authority_00020,A_order_stance,0,,"The text does not contain any stance supporting or opposing obedience, deference, or social order."
