text_id,clause,answer,evidence,justification
authority_00547,X_loyalty,0,,The passage critiques elitists and the establishment but does not discuss loyalty or betrayal within any group.
authority_00547,A_order_stance,1,estes elitistas são o ente-establishment. estão a drenar o pântano!,"The text criticizes the establishment, opposing the existing social order and implying defiance against it."
authority_00547,A_order_values,1,estes elitistas são o ente‑establishment. estão a drenar o pântano!,"The text negatively frames the establishment—a form of social order—by calling it elitist and accusing it of draining the swamp, thus rejecting that social order."
authority_00547,A_assess_authority,1,estes elitistas são o ente‑establishment. estão a drenar o pântano!,"The text negatively judges the establishment (an authority) as draining the swamp, evaluating its conduct and legitimacy as a power holder."
authority_00548,D_entity,1,"Putin faz a Hillary esconder emails, mentir às autoridades","The passage explicitly names political leaders (Putin) and refers to 'authorities', indicating reference to authority figures."
authority_00548,X_equality,0,,The text discusses political actions and accusations without mentioning any group-based discrimination or unequal treatment.
authority_00548,X_proportionality,1,agora o Putin fez o Fillon tornar-se corrupto para a Le Pen ganhar,"The text explicitly mentions corruption, indicating concern about corrupt behavior."
authority_00548,X_loyalty,0,,The text criticizes political figures and the left but does not explicitly raise a concern about loyalty or betrayal within a group.
authority_00548,A_order_stance,0,,"The text discusses political accusations and insults without addressing obedience, deference, or social order."
authority_00548,A_order_values,0,,"The text discusses political accusations and does not evaluate obedience, hierarchy, tradition, or social order as values."
authority_00548,A_assess_authority,1,agora o Putin fez o Fillon tornar-se corrupto para a Le Pen ganhar,"The text evaluates Putin’s conduct as a power holder, labeling his actions corrupt and manipulative."
authority_00549,D_entity,0,,"The text contains only a personal admonition and an insult, with no reference to any authority, ruler, institution, or social order."
authority_00549,X_equality,0,,
authority_00549,X_proportionality,0,,"The text discusses abuse related to weight gain and does not mention corruption, nepotism, cheating, or unfair reward."
authority_00549,X_loyalty,0,,"The text discusses personal behavior toward a girlfriend, not concerns about loyalty or betrayal toward a group."
authority_00549,A_order_stance,0,,"The text condemns abuse but does not express a stance on obedience, deference, or social order."
authority_00549,A_order_values,0,,"The text does not mention or evaluate obedience, hierarchy, tradition, or social order as values."
authority_00549,A_assess_authority,0,,"The text attacks a troll and does not evaluate any authority, leader, or institution in a power role."
authority_00550,D_entity,1,não se pode alegar que esta lista foi criada para se adequar a Trump,"The text explicitly references Trump, a political leader, indicating a reference to an authority-holder."
authority_00550,X_equality,1,4. Sexismo desenfreado,"The text lists 'Sexismo desenfreado' as a warning sign, indicating concern about sexism, a form of group-based discrimination."
authority_00550,X_proportionality,1,Clientelismo e corrupção desenfreados,"The text explicitly lists 'Clientelismo e corrupção desenfreados', indicating a concern about corruption."
authority_00550,X_loyalty,0,,The text lists general fascist warning signs and does not explicitly discuss loyalty to or betrayal of an in-group.
authority_00550,A_order_stance,0,,"The passage only lists fascist warning signs and does not contain any explicit support for or opposition to obedience, deference, or social order."
authority_00550,A_order_values,0,,"The text lists fascist warning signs and does not evaluate obedience, hierarchy, tradition, or social order as values."
authority_00550,A_assess_authority,0,,"The text only lists general warning signs of fascism and does not evaluate any specific authority, leader, or institution in terms of its power role."
authority_00551,D_entity,0,,
authority_00551,X_equality,0,,The passage only expresses personal dislike and frustration without referencing any group-based discrimination or unequal treatment.
authority_00551,X_proportionality,0,,"The text expresses personal dislike and frustration but does not mention corruption, nepotism, cheating, or unfair reward."
authority_00551,X_loyalty,0,,"The passage expresses personal dislike and resentment toward parents, without mentioning loyalty or betrayal to any group."
authority_00551,A_order_stance,1,desprezava os meus pais quando me obrigavam a pô-las,"The speaker expresses contempt for being forced by parents, indicating opposition to obedience and deference."
authority_00551,A_order_values,0,,
authority_00551,A_assess_authority,0,,"The text only expresses personal dislike toward parents forcing something, without evaluating any authority's legitimacy or fitness to hold power."
authority_00552,D_entity,1,Hamon ... Mélenchon ... Macron ... Fillon,The text names several political figures who are authority-holders.
authority_00552,X_equality,0,,"The text only references political figures and directions, without mentioning any form of group-based discrimination or unequal treatment."
authority_00552,X_proportionality,0,,"The text only describes political positioning and expresses confusion about France, without mentioning corruption, nepotism, cheating, or unfair reward."
authority_00552,X_loyalty,0,,"The text only comments on political positioning and a lack of understanding of France, without mentioning loyalty or betrayal toward any group."
authority_00552,A_order_stance,0,,"The text only describes positioning political figures and expresses confusion about France, without any reference to obedience, deference, or social order."
authority_00552,A_order_values,0,,"The text discusses political positioning without evaluating obedience, hierarchy, tradition, or social order as values."
authority_00552,A_assess_authority,0,,"The text merely positions political figures on a map without judging their fitness, legitimacy, or conduct as authorities."
authority_00553,D_entity,1,"""não contar aos teus pais""","The text refers to 'pais', which are authority figures (parents)."
authority_00553,X_equality,0,,"The text discusses personal punishment and concern, without mentioning any group-based discrimination or unequal treatment."
authority_00553,X_proportionality,0,,"The passage discusses fear of punishment and seriousness but does not mention corruption, nepotism, cheating, or unfair merit."
authority_00553,X_loyalty,1,Isto só vai piorar se o encobrires ... estou francamente estupefacto que sequer consideres não contar aos teus pais.,"The text explicitly worries that covering up the wrongdoing would be a betrayal of the group’s expectations, emphasizing loyalty to punish the offender."
authority_00553,A_order_stance,1,Ele tem de ser castigado.,"The speaker explicitly urges that the person must be punished, supporting obedience to authority and social order."
authority_00553,A_order_values,1,Ele tem de ser castigado. ... que sequer consideres não contar aos teus pais.,"The text endorses punishment and reporting to parents, upholding hierarchical authority as a valued norm."
authority_00553,A_assess_authority,0,,"The text discusses personal punishment and seriousness but does not evaluate any authority, leader, or institution in its power role."
authority_00554,D_entity,1,Macron será um excelente líder,"The text explicitly refers to Macron as a leader, which is an authority-holder."
authority_00554,X_equality,1,"O povo francês disse hoje ""não"" ao racismo, disse ""não"" à intolerância","The text explicitly references rejecting racism and intolerance, indicating a concern about group-based discrimination."
authority_00554,X_proportionality,0,,"The passage discusses racism, intolerance, and leadership preferences, but does not raise any concern about corruption, nepotism, cheating, or unfair reward."
authority_00554,X_loyalty,0,,The passage expresses opinions about racism and leadership but does not raise any concern about loyalty or betrayal toward a group.
authority_00554,A_order_stance,1,Macron será um excelente líder e vais ter de engolir as tuas palavras.,"The text praises a leader and tells the addressee to swallow their words, urging compliance with authority."
authority_00554,A_order_values,0,,"The text does not contain any explicit statements evaluating obedience, hierarchy, tradition, or social order as values."
authority_00554,A_assess_authority,1,Macron será um excelente líder,"The text explicitly praises Macron's fitness to lead, evaluating him as an excellent leader."
authority_00555,D_entity,1,eleitores de Le Pen,"The text references Le Pen, a political leader and candidate for power, which qualifies as an authority-holder."
authority_00555,X_equality,1,filhos de imigrantes recentes que praticam o Islão... É sobre a imigração de grupos de pessoas cujos valores e cultura levam a problemas de integração e agitação social.,The text explicitly discusses discrimination against immigrant groups based on their religion and culture.
authority_00555,X_proportionality,0,,"The passage focuses on immigration and cultural integration issues, without mentioning corruption, nepotism, cheating, or unfair merit-based outcomes."
authority_00555,X_loyalty,0,,"The passage discusses immigration and cultural integration without mentioning loyalty, betrayal, or solidarity within a group."
authority_00555,A_order_stance,0,,"The text discusses immigration and social integration without any explicit support for or opposition to obedience, deference, or social order."
authority_00555,A_order_values,0,,"The text discusses immigration and cultural values causing integration problems but does not explicitly evaluate obedience, hierarchy, tradition, or social order as values."
authority_00555,A_assess_authority,0,,"The text discusses opinions about immigrants and Le Pen's voters but does not evaluate any authority, leader, or institution in its power role."
authority_00556,D_entity,1,"As ligações empresariais do Macron são uma treta, mas sem outra alternativa viável à Le Pen, ele é o melhor que podemos esperar por agora.","The text mentions political leaders Macron and Le Pen, who are authority‑holders."
authority_00556,X_equality,0,,The text discusses political preferences and criticisms without mentioning any group-based discrimination or unequal treatment.
authority_00556,X_proportionality,1,As ligações empresariais do Macron são uma treta,"The text explicitly criticizes Macron's business connections as a problem, indicating a concern about corruption or unfair advantage."
authority_00556,X_loyalty,0,,The passage discusses political choices and criticisms of Macron's business ties but does not raise a concern about loyalty or betrayal toward any in-group.
authority_00556,A_order_stance,0,,
authority_00556,A_order_values,0,,"The text discusses political choices and compromises without explicitly evaluating obedience, hierarchy, tradition, or social order as values."
authority_00556,A_assess_authority,1,"As ligações empresariais do Macron são uma treta, mas sem outra alternativa viável à Le Pen, ele é o melhor que podemos esperar por agora.","The passage explicitly assesses Macron's conduct and fitness as a leader, judging his business ties as a flaw yet deeming him the best available option for power."
authority_00557,D_entity,1,Vai à polícia para recuperar o teu carro.,"The text explicitly refers to the police, which is an authority figure."
authority_00557,X_equality,0,,The text discusses personal relationship dynamics and does not mention any group-based discrimination or unequal treatment.
authority_00557,X_proportionality,0,,"The text discusses personal relationship abuse and control, not corruption, nepotism, cheating, or unfair merit-based reward."
authority_00557,X_loyalty,0,,"The passage focuses on an individual relationship and does not mention loyalty or betrayal toward any group, team, party, or nation."
authority_00557,A_order_stance,1,Vai à polícia para recuperar o teu carro. E sai. Ele não é o teu patrão. Não é assim que uma relação deve ser.,"The text explicitly urges the listener to resist obedience to the abusive person and to involve authorities, opposing deference."
authority_00557,A_order_values,1,Ele não é o teu patrão. Não é assim que uma relação deve ser.,The text rejects hierarchical obedience by stating the partner is not a boss and that such compliance is not how a relationship should be.
authority_00557,A_assess_authority,0,,"The text critiques a personal relationship partner, not a political authority or institution exercising power."
authority_00558,D_entity,0,,"The text only mentions workers and a general statement about the 21st century without naming any authority, ruler, institution, or collective power."
authority_00558,X_equality,1,"os mais afetados são os trabalhadores de fábricas e quintas, o que os deixa sem nada para fazer e sem uma forma fácil de pagar as contas","The text highlights the hardship of factory and farm workers, indicating concern about their unequal treatment and disadvantage."
authority_00558,X_proportionality,0,,"The text does not explicitly mention corruption, nepotism, cheating, or unfair reward."
authority_00558,X_loyalty,1,Será realmente uma surpresa que estejam a tentar virar MAGA?,"The text questions whether the group is attempting to become MAGA, indicating concern about their loyalty or possible betrayal of their original side."
authority_00558,A_order_stance,0,,"The text discusses economic hardship and criticism of the 21st century but does not express a stance on obedience, deference, or social order."
authority_00558,A_order_values,0,,"The passage discusses economic hardship of workers and a negative view of the 21st century, without evaluating obedience, hierarchy, tradition, or social order as values."
authority_00558,A_assess_authority,0,,"The passage discusses workers and a vague reference to ""MAGA"" but does not evaluate any specific authority, leader, or institution in terms of its power or legitimacy."
authority_00559,D_entity,0,,"The passage only discusses personal opinions and COVID denialists without naming any authority, institution, or social order."
authority_00559,X_equality,0,,The text discusses covid denialism and hypocrisy but does not mention any group-based discrimination or unequal treatment.
authority_00559,X_proportionality,0,,"The passage only criticizes hypocrisy regarding COVID mask usage and does not mention corruption, nepotism, cheating, or unfair reward."
authority_00559,X_loyalty,0,,"The passage critiques hypocrisy and covid denial but does not mention loyalty, solidarity, or betrayal toward any group."
authority_00559,A_order_stance,1,"""não usar máscara enquanto se vai às compras é 'pensamento independente'. Não precisamos desse tipo de hipocrisia.""","The text condemns the refusal to wear a mask, opposing defiance of health guidelines and thus supporting obedience to social order."
authority_00559,A_order_values,0,,"The text critiques mask‑avoidance and hypocrisy but does not explicitly evaluate obedience, hierarchy, tradition, or social order as values."
authority_00559,A_assess_authority,0,,The text critiques Rush's statements about COVID but does not evaluate his authority or legitimacy as a holder of power.
authority_00560,D_entity,1,A proibição da China foi 2 meses tarde?,"The text refers to a prohibition enacted by China, which is a governmental authority, thus naming an authority."
authority_00560,X_equality,0,,The text discusses timing of a prohibition and a law but does not mention any group-based discrimination or unequal treatment.
authority_00560,X_proportionality,0,,"The text only questions delays in actions and does not explicitly mention corruption, nepotism, cheating, or unfair reward."
authority_00560,X_loyalty,0,,"The text questions timing of actions and expresses frustration but does not mention loyalty, solidarity, or betrayal toward any group."
authority_00560,A_order_stance,0,,"The text questions delays and expresses frustration but does not explicitly support or oppose obedience, deference, or social order."
authority_00560,A_order_values,0,,"The text does not explicitly evaluate obedience, hierarchy, tradition, or social order as values."
authority_00560,A_assess_authority,0,,"The text only questions the timing of actions and does not evaluate any authority's conduct, legitimacy, or fitness as a holder of power."
authority_00561,D_entity,0,,"The text does not mention any authority, official, institution, or social order."
authority_00561,X_equality,0,,The text discusses medical claims about stents and does not mention any group-based discrimination or unequal treatment.
authority_00561,X_proportionality,0,,"The passage only addresses medical claims about stents and does not mention corruption, nepotism, cheating, or unfair reward."
authority_00561,X_loyalty,0,,The passage only addresses a medical claim about stents and does not mention any concern about loyalty or betrayal toward a group.
authority_00561,A_order_stance,0,,"The passage discusses medical claims about stents and does not address obedience, deference, or social order."
authority_00561,A_order_values,0,,"The text discusses medical claims about stents and does not mention obedience, hierarchy, tradition, or social order as values."
authority_00561,A_assess_authority,0,,"The text only discusses medical claims about stents and does not evaluate any authority, leader, or institution in a power role."
authority_00562,D_entity,1,"""Partido Democrata Americano não respeitou o seu próprio processo democrático""","The text refers to the American Democratic Party and democracy, which are collective authorities/institutions."
authority_00562,X_equality,0,,"The passage critiques political actions and rhetoric but does not explicitly mention racism, sexism, or any unfair treatment of a specific social group."
authority_00562,X_proportionality,0,,
authority_00562,X_loyalty,1,quando o Partido Democrata Americano não respeitou o seu próprio processo democrático e conspirou para eliminar um dos seus candidatos a favor do outro,"The passage criticizes the party for betraying its own democratic process and favoring one candidate over another, highlighting concerns about in‑group loyalty and betrayal."
authority_00562,A_order_stance,0,,"The passage critiques political behavior but does not explicitly call for obedience, deference, or rebellion, so there is no clear stance on social order."
authority_00562,A_order_values,0,,"The text discusses political parties and democracy without evaluating obedience, hierarchy, tradition, or social order as values."
authority_00562,A_assess_authority,1,"""Partido Democrata Americano não respeitou o seu próprio processo democrático e conspirou para eliminar um dos seus candidatos a favor do outro?""","The text judges the Democratic Party's conduct as a holder of political power, labeling its actions as undemocratic and conspiratorial."
authority_00563,D_entity,1,Meu Deus.,"The phrase directly invokes God, which is a religious authority."
authority_00563,X_equality,1,Os subsídios de assistência social e de invalidez são tostões e migalhas.,"The text complains that social assistance and disability subsidies are merely token amounts, highlighting a concern about the unequal treatment of these socially disadvantaged groups."
authority_00563,X_proportionality,1,Os subsídios de assistência social e de invalidez são tostões e migalhas.,"The text complains that social assistance subsidies are merely crumbs, indicating that people receive far less than they deserve."
authority_00563,X_loyalty,0,,The text discusses the inadequacy of social assistance subsidies and does not mention any concern about loyalty or betrayal toward a group.
authority_00563,A_order_stance,0,,"The text critiques social assistance subsidies and does not express support for or opposition to obedience, deference, or social order."
authority_00563,A_order_values,0,,"The text discusses social assistance subsidies and does not mention obedience, hierarchy, tradition, or social order as values."
authority_00563,A_assess_authority,0,,"The text criticizes social subsidies but does not evaluate any specific authority, leader, or institution in its power role."
authority_00564,D_entity,1,polícia francesa,"The text explicitly mentions the French police, which is an authority figure."
authority_00564,X_equality,0,,The passage contains insults and political references but does not raise any concern about group-based discrimination or unequal treatment.
authority_00564,X_proportionality,0,,"The text does not mention corruption, nepotism, cheating, or unfair reward, focusing instead on legal and personal criticisms."
authority_00564,X_loyalty,0,,"The text does not discuss solidarity or treachery toward any group, team, party, or nation."
authority_00564,A_order_stance,0,,
authority_00564,A_order_values,0,,"The text does not discuss obedience, hierarchy, tradition, or social order as values."
authority_00564,A_assess_authority,1,"perguntares à própria Le Pen porque é que ela não apresentou queixa ... ela é provavelmente a pessoa que pode apresentar queixa e não o fez, por escolha própria, ninguém a está a impedir","The text judges Le Pen's conduct as a political figure by stating she could file a complaint but chose not to, evaluating her role as an authority."
authority_00565,D_entity,0,,"The text does not mention any authority, official, or social order."
authority_00565,X_equality,0,,The text discusses personal feelings and envy without mentioning any group-based discrimination or unequal treatment.
authority_00565,X_proportionality,0,,"The text discusses envy and fairness in a lottery context but does not mention corruption, nepotism, cheating, or unfair reward."
authority_00565,X_loyalty,0,,The passage discusses personal feelings of annoyance and jealousy without referencing loyalty or betrayal toward any group.
authority_00565,A_order_stance,0,,"The text does not discuss obedience, deference, or social order, nor does it support or oppose them."
authority_00565,A_order_values,0,,"The text does not discuss obedience, hierarchy, tradition, or social order as values."
authority_00565,A_assess_authority,0,,"The text does not evaluate any authority, leader, institution, or power holder, but merely discusses personal feelings and hypothetical situations."
authority_00566,D_entity,1,o Macron devia governar,"The text explicitly mentions Macron as a ruler who should govern, which is an authority figure."
authority_00566,X_equality,0,,The passage discusses individuals (Macron and Mr. Bernke) and does not mention any group-based discrimination or unequal treatment.
authority_00566,X_proportionality,0,,"The text does not mention corruption, nepotism, cheating, or any issue of unfair reward or merit."
authority_00566,X_loyalty,0,,"The text does not mention solidarity or treachery toward any group, party, or nation."
authority_00566,A_order_stance,1,o Macron devia governar porque é inferior ao mr bernke.,"The statement endorses a hierarchical social order by asserting that Macron should govern, supporting obedience to a designated authority."
authority_00566,A_order_values,1,"Governar diretamente sobre nós, mortais, está abaixo do grande quantitative easer.","The text rejects direct governance, thereby evaluating a form of social order as undesirable."
authority_00566,A_assess_authority,1,o Macron devia governar porque é inferior ao mr bernke,"The text evaluates Macron's authority by judging his fitness to govern, thus assessing his power role."
authority_00567,D_entity,1,"""os meus pais só chegam tarde do trabalho""","The text explicitly refers to ""os meus pais"", which are authority figures (parents) within the family."
authority_00567,X_equality,0,,"The passage talks about family expectations and financial hardship, without mentioning any group-based discrimination or unequal treatment."
authority_00567,X_proportionality,0,,"The text discusses family responsibilities and potential abuse, without mentioning corruption, nepotism, cheating, or unfair reward."
authority_00567,X_loyalty,0,,"The text discusses family responsibilities and financial hardship, without mentioning loyalty or betrayal toward any group."
authority_00567,A_order_stance,0,,"The text critiques an expectation but does not explicitly support or call for obedience, defiance, or rebellion."
authority_00567,A_order_values,0,,"The text discusses expectations about sibling care but does not explicitly evaluate obedience, hierarchy, tradition, or social order as values."
authority_00567,A_assess_authority,0,,"The text discusses family responsibilities and does not evaluate any authority, leader, or institution in a power role."
authority_00568,D_entity,0,,"The text does not explicitly name or refer to any authority, official, or social order."
authority_00568,X_equality,0,,"The text does not mention any concern about racism, sexism, oppression, or unfair exclusion of a social group."
authority_00568,X_proportionality,0,,"The text does not mention corruption, nepotism, cheating, or unfair reward."
