text_id,clause,answer,evidence,justification
authority_00190,A_assess_authority,1,O que aconteceu a todas as intimações que os republicans têm ignorado? ... aceitação passiva de ignorarem a lei.,The text judges the Republicans' conduct in power by criticizing their passive acceptance of ignoring subpoenas and the law.
authority_00191,D_entity,0,,"The text does not mention any authority, authority-holder, or social order."
authority_00191,X_equality,0,,
authority_00191,X_proportionality,0,,"The text only states that it is the best answer based on common sense and proven psychology, with no mention of corruption, nepotism, cheating, or unfair reward."
authority_00191,X_loyalty,0,,"The text does not mention any concern about loyalty, betrayal, or solidarity within a group."
authority_00191,A_order_stance,0,,"The text only praises an answer's quality and does not mention obedience, deference, or social order."
authority_00191,A_order_values,0,,"The text contains no mention of obedience, hierarchy, tradition, or social order as values."
authority_00191,A_assess_authority,0,,"The text only praises an answer and does not assess any authority, leader, institution, or power holder."
authority_00192,D_entity,0,,"The text only mentions stress and people working more, without referencing any authority or social order."
authority_00192,X_equality,0,,The text only comments on workload stress and does not mention any form of group-based discrimination or unequal treatment.
authority_00192,X_proportionality,0,,"The text only discusses stress and workload, without mentioning corruption, nepotism, cheating, or unfair reward."
authority_00192,X_loyalty,0,,"The text only comments on stress and work effort, without mentioning loyalty, betrayal, or group solidarity."
authority_00192,A_order_stance,0,,"The text does not discuss obedience, deference, or social order, nor supports or opposes them."
authority_00192,A_order_values,0,,"The text does not discuss obedience, hierarchy, tradition, or social order as values."
authority_00192,A_assess_authority,0,,"The text only comments on stress and workload, without evaluating any authority, leader, or institution in a power role."
authority_00193,D_entity,1,Se calhar a Le Pen e o partido dela deviam tentar mudar as leis...,"The text explicitly mentions the politician Le Pen and refers to laws, both of which are forms of authority."
authority_00193,X_equality,0,,The text critiques political actions and mentions a Nazi reference but does not raise a concern about group-based discrimination or unequal treatment.
authority_00193,X_proportionality,1,A Le Pen vai pagar a multa com o dinheiro do pai nazi,"The text criticizes Le Pen for using her father's money to pay a fine, implying nepotism or unfair advantage."
authority_00193,X_loyalty,0,,The text critiques Le Pen and her party's actions but does not discuss loyalty or betrayal toward their own group.
authority_00193,A_order_stance,0,,
authority_00193,A_order_values,1,"""deviam tentar mudar as leis em vez de as violar""","The text endorses respecting laws rather than breaking them, indicating an evaluation of social order as a valued principle."
authority_00193,A_assess_authority,1,Se calhar a Le Pen e o partido dela deviam tentar mudar as leis em vez de as violar,"The text judges Le Pen's conduct as a political leader, criticizing her for violating laws and implying she is unfit to exercise power."
authority_00194,D_entity,1,"""o establishment""","The text explicitly refers to ""the establishment"", which is a collective authority."
authority_00194,X_equality,0,,"The passage only describes political attacks between figures and does not mention any concern about racism, sexism, or other group-based discrimination."
authority_00194,X_proportionality,1,a dar a entender que ele tinha contas offshore,The text raises a concern about possible corruption by suggesting the person may have offshore accounts.
authority_00194,X_loyalty,0,,The text discusses political attacks between parties but does not raise a concern about loyalty or betrayal within a group.
authority_00194,A_order_stance,0,,"The text discusses political attacks and accusations without any reference to obedience, deference, or social order."
authority_00194,A_order_values,0,,"The text does not contain any explicit evaluation of obedience, hierarchy, tradition, or social order as values."
authority_00194,A_assess_authority,0,,"The text only describes political attacks between candidates without explicitly judging their legitimacy, fitness, or authority in a power role."
authority_00195,D_entity,1,Trump,"The text explicitly references Trump, a former political leader, which qualifies as an authority figure."
authority_00195,X_equality,0,,The text discusses geopolitical dynamics and does not mention any group-based discrimination or unequal treatment.
authority_00195,X_proportionality,1,Pentágono e globalcornos usam Trump como marioneta,"The statement alleges that the Pentagon and global elites are using Trump as a puppet, indicating a concern about corrupt manipulation."
authority_00195,X_loyalty,0,,"The text does not mention any concern about loyalty or betrayal within a group, team, party, or nation."
authority_00195,A_order_stance,0,,
authority_00195,A_order_values,0,,"The text does not discuss obedience, hierarchy, tradition, or social order as values."
authority_00195,A_assess_authority,1,Pentágono e globalcornos usam Trump como marioneta,"The text evaluates Trump’s authority by labeling him a puppet used by the Pentagon and global elites, judging his fitness to hold power."
authority_00196,D_entity,0,,"The text discusses high incomes and tax payments but does not name or refer to any authority, official, or social order."
authority_00196,X_equality,0,,"The text discusses taxation of high incomes without mentioning discrimination or unequal treatment based on race, gender, or other protected social groups."
authority_00196,X_proportionality,1,"Estas pessoas têm tanto dinheiro que, basicamente, pagam para não pagar impostos.",The statement highlights that wealthy individuals are cheating the tax system by paying to avoid taxes.
authority_00196,X_loyalty,0,,The text discusses taxation of high incomes and does not mention any concern about loyalty or betrayal toward a group.
authority_00196,A_order_stance,0,,"The text discusses taxation of high incomes and does not express support for or opposition to obedience, deference, or social order."
authority_00196,A_order_values,0,,"The text discusses taxation of high incomes and does not evaluate obedience, hierarchy, tradition, or social order as values."
authority_00196,A_assess_authority,0,,"The text discusses taxation of high incomes and wealthy individuals, not evaluating any authority, leader, or institution in its power role."
authority_00197,D_entity,0,,"The passage only mentions individuals (he, you) and does not name or refer to any authority, institution, or social order."
authority_00197,X_equality,0,,The text discusses personal trust and deception without referencing any group-based discrimination or unequal treatment.
authority_00197,X_proportionality,1,Esta artimanha de engano atrás de engano,"The text mentions a deceptive trick, indicating concern about cheating."
authority_00197,X_loyalty,1,Ele nunca mais vai confiar numa palavra que digas.,"The text warns that deception will cause loss of trust and prevent seeing one's own child, indicating concern about betrayal within a close group."
authority_00197,A_order_stance,0,,"The text discusses trust and deception, without any reference to obedience, deference, or social order."
authority_00197,A_order_values,0,,"The passage discusses trust and deception, with no mention or evaluation of obedience, hierarchy, tradition, or social order as values."
authority_00197,A_assess_authority,0,,"The text does not evaluate any authority, leader, institution, or power holder, only expresses personal distrust."
authority_00198,D_entity,1,violação da maioria das leis estaduais de manipulação de alimentos ... leis de emprego à vontade,"The text explicitly refers to state food‑handling laws and at‑will employment laws, which are authorities governing behavior."
authority_00198,X_equality,0,,The passage discusses workplace safety and termination without referencing any social group or discrimination.
authority_00198,X_proportionality,1,"Ser despedido por se recusar a fazê-lo, sob o pretexto de ser despedido por outro motivo não relacionado ... agora ficas sem rendimentos.","The text highlights unfair dismissal leading to loss of income, indicating a concern about someone receiving less than they deserve."
authority_00198,X_loyalty,0,,The passage discusses food safety laws and employment issues without referencing any in-group loyalty or betrayal.
authority_00198,A_order_stance,0,,"The text merely states legal facts about food handling and employment without urging obedience, deference, or defiance."
authority_00198,A_order_values,0,,"The text discusses legal violations and employment issues without explicitly endorsing or condemning obedience, hierarchy, tradition, or social order as values."
authority_00198,A_assess_authority,0,,"The text discusses legal violations and employment issues but does not evaluate any authority, leader, or institution in its power role."
authority_00199,D_entity,1,"gostava que o Macron e o Fillon, que percebem mesmo da economia e da UE, a tivessem interrompido","The text explicitly mentions political leaders Macron and Fillon, who are authorities."
authority_00199,X_equality,0,,The text only criticizes an individual's behavior and does not mention any group-based discrimination or unequal treatment.
authority_00199,X_proportionality,1,como é possível mentir tanto,"The text explicitly complains about lying, which constitutes a concern about cheating."
authority_00199,X_loyalty,0,,"The passage expresses annoyance about someone's behavior but does not discuss loyalty or betrayal toward any group, team, party, or nation."
authority_00199,A_order_stance,1,"gostava que o Macron e o Fillon, que percebem mesmo da economia e da UE, a tivessem interrompido mais quando ela disse aquilo, porque é inaceitável","The speaker urges authority figures to intervene and stop the disruptive behavior, supporting obedience to legitimate authority and social order."
authority_00199,A_order_values,0,,"The text criticizes someone's behavior but does not discuss obedience, hierarchy, tradition, or social order as values."
authority_00199,A_assess_authority,1,"gostava que o Macron e o Fillon, que percebem mesmo da economia e da UE, a tivessem interrompido mais","The text positively evaluates Macron and Fillon’s competence in economic and EU matters, judging their fitness as authorities."
authority_00200,D_entity,1,"Eles elogiam Putin, Orban e Trump enquanto cagam em Merkel, Macron","The passage references political leaders, which are authority figures such as a ruler or politician."
authority_00200,X_equality,0,,"The text critiques political bias and admiration for certain leaders, but does not raise concerns about discrimination or unequal treatment based on a protected social group."
authority_00200,X_proportionality,0,,"The text critiques political preferences but does not explicitly mention corruption, nepotism, cheating, or unfair reward."
authority_00200,X_loyalty,1,"Eles elogiam Putin, Orban e Trump enquanto cagam em Merkel, Macron e qualquer pessoa que não seja de direita.","The text points out the supporters' strong allegiance to right-wing leaders and disparagement of outsiders, raising a concern about in-group loyalty."
authority_00200,A_order_stance,0,,"The text discusses political preferences and criticism but does not explicitly support or oppose obedience, deference, or social order."
authority_00200,A_order_values,0,,"The passage discusses political preferences and admiration for leaders but does not evaluate obedience, hierarchy, tradition, or social order as values."
authority_00200,A_assess_authority,1,"""não um empresário falhado sem experiência política anterior""","The text judges Trump as a failed businessman lacking political experience, evaluating his fitness to hold power."
authority_00201,D_entity,1,figuras de autoridade,"The text mentions 'figuras de autoridade', referring to authority figures."
authority_00201,X_equality,0,,"The text discusses the lack of authority figures teaching kindness, without mentioning any group-based discrimination or unequal treatment."
authority_00201,X_proportionality,0,,"The text discusses the lack of authority figures teaching kindness, not concerns about corruption, nepotism, cheating, or unfair reward."
authority_00201,X_loyalty,0,,"The text discusses the lack of authority figures teaching kindness, without mentioning loyalty or betrayal toward any group."
authority_00201,A_order_stance,1,"O número de figuras de autoridade ausentes para ensinar um homem a ser amável, cortês e atencioso com os outros seres humanos neste mundo é alto demais.","The text explicitly critiques the lack of authority figures, implying support for the role of authority in maintaining social order and proper behavior."
authority_00201,A_order_values,1,"O número de figuras de autoridade ausentes para ensinar um homem a ser amável, cortês e atencioso com os outros seres humanos neste mundo é alto demais.","The text values authority figures as necessary for teaching proper behavior, thereby upholding hierarchy as a positive social value."
authority_00201,A_assess_authority,0,,"The text only comments on the general absence of authority figures, not evaluating any specific authority, leader, or institution in its power role."
authority_00202,D_entity,1,pai/mãe,"The text explicitly refers to parents, who are authority figures."
authority_00202,X_equality,0,,The text discusses a personal family situation and does not mention any group-based discrimination or unequal treatment.
authority_00202,X_proportionality,1,enganou de propósito o pai/mãe,"The text mentions deliberate deception, indicating a concern about cheating or unfair treatment."
authority_00202,X_loyalty,1,alguém que enganou de propósito o pai/mãe,"The text explicitly mentions someone deliberately deceiving a parent, highlighting betrayal within the family group."
authority_00202,A_order_stance,0,,"The passage discusses a child's situation and advises apologizing, but contains no explicit stance on obedience, deference, or social order."
authority_00202,A_order_values,0,,"The text does not discuss obedience, hierarchy, tradition, or social order as values, only a specific family situation."
authority_00202,A_assess_authority,0,,"The text discusses family relationships and does not evaluate any authority, leader, institution, or power holder."
authority_00203,D_entity,1,O Fillon era popular,"The text names ""Fillon,"" a political figure, which is an authority-holder."
authority_00203,X_equality,0,,The text does not mention any concern about group-based discrimination or unequal treatment.
authority_00203,X_proportionality,0,,"The text does not mention corruption, nepotism, cheating, or unfair reward."
authority_00203,X_loyalty,0,,The text discusses political labels and shared conservative values but does not mention any concern about loyalty or betrayal toward a group.
authority_00203,A_order_stance,0,,"The text discusses political conservatism and shared values, without any stance on obedience, deference, or social order."
authority_00203,A_order_values,0,,"The text only mentions conservative values generally without explicitly evaluating obedience, hierarchy, tradition, or social order as values."
authority_00203,A_assess_authority,0,,"The text only mentions Fillon's popularity and does not evaluate his fitness, legitimacy, or conduct as a holder of power."
authority_00204,D_entity,0,,"The text only mentions a friend, a monster, a village, and Ewoks, with no reference to any authority or social order."
authority_00204,X_equality,0,,The text describes a fictional monster attack and does not mention any group-based discrimination or unequal treatment.
authority_00204,X_proportionality,0,,"The text only describes nostalgic events involving a monster and does not mention any concerns about corruption, nepotism, cheating, or unfair reward."
authority_00204,X_loyalty,0,,The passage merely recounts past actions without expressing any concern about loyalty or betrayal.
authority_00204,A_order_stance,0,,"The text merely recounts a personal anecdote about attacking a village and does not express any stance supporting or opposing obedience, deference, or social order."
authority_00204,A_order_values,0,,"The text does not discuss obedience, hierarchy, tradition, or social order as values."
authority_00204,A_assess_authority,0,,"The text only describes a nostalgic anecdote about a monster and Ewoks, without evaluating any authority or power holder."
authority_00205,D_entity,0,,"The passage gives personal advice and does not name or refer to any authority, law, or institutional rule."
authority_00205,X_equality,0,,The text only advises against asking a woman out at her workplace and does not discuss group-based discrimination or unequal treatment.
authority_00205,X_proportionality,0,,"The text addresses inappropriate romantic behavior, not concerns about corruption, nepotism, cheating, or unfair reward."
authority_00205,X_loyalty,0,,The text advises against asking a woman out at her workplace and does not discuss loyalty or betrayal toward any group.
authority_00205,A_order_stance,1,"Por favor, não vás ao local de trabalho de uma mulher pedir-lhe para sair, do nada, sem qualquer indicação de que ela está solteira ou interessada em ti.","The text urges respecting personal boundaries and refraining from intrusive behavior, supporting social order and deference."
authority_00205,A_order_values,0,,"The text does not discuss obedience, hierarchy, tradition, or social order as values, but rather advises against a specific behavior."
authority_00205,A_assess_authority,0,,"The passage discusses personal behavior and does not evaluate any authority, leader, institution, or power holder."
authority_00206,D_entity,1,a Le Pen teria pessoalmente travado,"The text references Le Pen, a political leader, which qualifies as an authority-holder."
authority_00206,X_equality,0,,The text discusses Le Pen preventing terrorist attacks and does not mention any group-based discrimination or unequal treatment.
authority_00206,X_proportionality,0,,"The passage discusses Le Pen preventing terrorist attacks and does not mention corruption, nepotism, cheating, or unfair reward."
authority_00206,X_loyalty,0,,"The text does not discuss loyalty, solidarity, or betrayal toward any group, team, side, party, or nation."
authority_00206,A_order_stance,1,"Sim, porque a Le Pen teria pessoalmente travado todos os futuros ataques terroristas","The statement praises Le Pen for personally stopping future terrorist attacks, supporting obedience to authority and social order."
authority_00206,A_order_values,0,,"The text does not discuss obedience, hierarchy, tradition, or social order as values."
authority_00206,A_assess_authority,1,"Sim, porque a Le Pen teria pessoalmente travado todos os futuros ataques terroristas","The statement praises Le Pen’s personal ability to prevent terrorist attacks, evaluating her fitness and legitimacy as a leader."
authority_00207,D_entity,1,A Le Pen já é financiada através de bancos russos.,"The text names the politician Le Pen, who is an authority-holder."
authority_00207,X_equality,0,,The text discusses Russian money and disinformation but does not mention any group-based discrimination or unequal treatment.
authority_00207,X_proportionality,0,,
authority_00207,X_loyalty,0,,"The text discusses external threats from Russian money and disinformation, not concerns about loyalty or betrayal within a group."
authority_00207,A_order_stance,0,,"The text warns about Russian money and disinformation but does not express support for or opposition to obedience, deference, or social order."
authority_00207,A_order_values,0,,"The text discusses Russian money and disinformation but does not evaluate obedience, hierarchy, tradition, or social order as values."
authority_00207,A_assess_authority,1,A Le Pen já é financiada através de bancos russos.,"The text evaluates Marine Le Pen's legitimacy as a political leader by alleging corrupt Russian financing, thus judging her fitness to hold power."
authority_00208,D_entity,1,o Macron foi eleito com o projeto de reformar o código do trabalho,"The text refers to Macron, a political leader, which qualifies as an authority figure."
authority_00208,X_equality,0,,The text discusses labor reform timing and political context without mentioning any group-based discrimination or unequal treatment.
authority_00208,X_proportionality,0,,"The passage discusses timing of labor reforms and Macron's agenda, without mentioning corruption, nepotism, cheating, or unfair reward."
authority_00208,X_loyalty,0,,The passage discusses labor reform timing and Macron's agenda without mentioning any concern about loyalty or betrayal toward a group.
authority_00208,A_order_stance,0,,"The text discusses political reform timing without any reference to obedience, deference, or social order."
authority_00208,A_order_values,0,,"The text discusses political timing of reforms and does not evaluate obedience, hierarchy, tradition, or social order as values."
authority_00208,A_assess_authority,0,,"The passage merely describes Macron's election and reform plans without judging his fitness, legitimacy, or conduct as a holder of power."
authority_00209,D_entity,1,sem respeito pela lei,"The text refers to ""lei"", which is a law and thus an authority or rule."
authority_00209,X_equality,0,,The text only critiques an individual’s behavior and does not mention any group-based discrimination or unequal treatment.
authority_00209,X_proportionality,0,,"The text does not mention corruption, nepotism, cheating, or unfair reward, only criticism of hypocrisy and lack of respect."
authority_00209,X_loyalty,0,,"The text criticizes an individual's hypocrisy and lack of respect for law and life, without mentioning loyalty or betrayal toward any group."
authority_00209,A_order_stance,1,"O OP já mostrou ser um hipócrita sem respeito pela lei, por isso bastava demonstrar que também não tem respeito pela vida humana","The text condemns the OP's lack of respect for the law, thereby taking a stance supporting obedience and social order."
authority_00209,A_order_values,0,,"The text criticizes a lack of respect for law but does not explicitly evaluate obedience, hierarchy, tradition, or social order as values."
authority_00209,A_assess_authority,0,,"The text criticizes an individual (the OP) as a hypocrite without referencing any authority, leadership, or power role."
authority_00210,D_entity,1,Os presidentes de câmara destas cidades que permitem esta merda precisam de provar do seu próprio veneno.,"The passage explicitly refers to local government officials, which are authority figures."
authority_00210,X_equality,0,,The text only expresses frustration toward mayors and rioters without mentioning any form of group-based discrimination or unequal treatment.
authority_00210,X_proportionality,0,,"The text only complains about mayors allowing a situation, without explicitly mentioning corruption, nepotism, cheating, or unfair reward."
authority_00210,X_loyalty,0,,The text expresses support for rioters and criticizes officials but does not raise a concern about loyalty or betrayal within a group.
authority_00210,A_order_stance,1,"""estou a torcer por estes otários dos motins""","The text supports the rioters and condemns the authorities, indicating an anti‑obedience, anti‑social‑order stance."
authority_00210,A_order_values,1,Os presidentes de câmara destas cidades que permitem esta merda precisam de provar do seu próprio veneno.,"The passage condemns the local leaders' authority, expressing resentment toward hierarchical power and thus evaluating social order negatively."
authority_00210,A_assess_authority,1,Os presidentes de câmara destas cidades que permitem esta merda precisam de provar do seu próprio veneno.,"The passage evaluates the mayors as authorities, judging their conduct as unfit and condemning them for allowing the situation."
authority_00211,D_entity,1,"""leis do ruído"" e ""horas de silêncio estabelecidas legalmente pela comunidade""","The text references legally established noise laws and silence hours, which are forms of authority and social order."
authority_00211,X_equality,0,,"The passage concerns noise law violations and disturbance, without mentioning any group-based discrimination or unequal treatment."
authority_00211,X_proportionality,0,,"The passage concerns noise law violations and disturbance, without mentioning corruption, nepotism, cheating, or unfair reward."
authority_00211,X_loyalty,0,,The text criticizes a group's behavior violating noise laws but does not discuss loyalty or betrayal toward any group or side.
authority_00211,A_order_stance,1,Estão a violar as leis do ruído e a perturbar a vida dos moradores ... FORA das horas de silêncio estabelecidas legalmente pela comunidade.,"The text condemns the violation of noise laws and calls for adherence to legally established quiet hours, supporting social order."
authority_00211,A_order_values,1,Estão a violar as leis do ruído ... FORA das horas de silêncio estabelecidas legalmente pela comunidade.,"The text condemns the violation of noise laws and quiet‑hour regulations, upholding legal social order as a valued norm."
